{
  "run_id": "PROJECT-001-run-001",
  "task_id": "PROJECT-001",
  "project_id": "<project-id>",
  "agent": { "id": "codex-default", "runtime": "codex", "session_ref": null },
  "status": "created",
  "attempt": 1,
  "trigger": "assignment",
  "started_at": "yyyy-mm-ddThh:mm:ss+08:00",
  "heartbeat_at": null,
  "finished_at": null,
  "result_summary": null,
  "failure_reason": null,
  "artifacts": []
}
